{
  "connectorExecutionId": "connector-exec-20260704-ag-digitalz-first-content-sprint-build-live-result",
  "status": "done",
  "connectorId": "connector-github-mcp",
  "requestedAction": "create_branch_update_files_open_pr",
  "riskLevel": "R4",
  "projectId": "project-social-media-management-system-v1",
  "approvalRequired": true,
  "approvalId": "approval-20260704-ag-digitalz-first-content-sprint-build",
  "requiredPermissions": [
    "owner_approval",
    "active_approval_lock",
    "target_repo_exists",
    "target_main_branch_exists",
    "target_main_sha_verified",
    "boot_check_passed",
    "foundation_validation_passed",
    "runtime_tests_passed"
  ],
  "evidenceRequired": [
    "owner_approval_confirmed",
    "target_repository_scope_exact_match",
    "target_branch_scope_exact_match",
    "approved_file_manifest_exact_match",
    "target_repo_private",
    "target_repo_no_secret_marker_hits",
    "target_repo_no_private_client_data_marker_hits",
    "target_repo_no_deploy_config_marker_hits",
    "boot_check_passed",
    "foundation_validation_passed",
    "runtime_tests_passed",
    "target_check_passed",
    "target_test_passed",
    "target_build_passed",
    "target_draft_only_safety_assertion_passed",
    "pull_request_opened"
  ],
  "safety": {
    "executesLiveAction": true,
    "usesCredentials": false,
    "triggersDeployment": false,
    "changesDomain": false,
    "usesPaidAction": false,
    "accessesProductionData": false
  },
  "result": {
    "repositoryFullName": "gurnoorbassi/ag-social-media-management-system",
    "repositoryUrl": "https://github.com/gurnoorbassi/ag-social-media-management-system",
    "baseBranch": "main",
    "baseSha": "6f54d3b5b257c2662319f39c0b89f810e22289e5",
    "targetBranch": "ag-os/ag-digitalz-first-content-sprint-v1",
    "pullRequestNumber": 4,
    "pullRequestState": "open",
    "pullRequestUrl": "https://github.com/gurnoorbassi/ag-social-media-management-system/pull/4",
    "pullRequestMerged": false,
    "headSha": "02a749ff3348be9c57f34726f104f381e228b1cd",
    "filesChanged": [
      "README.md",
      "package.json",
      "index.html",
      "src/main.js",
      "src/styles.css",
      "src/data/templates.js",
      "src/lib/safety.js",
      "src/lib/status.js"
    ],
    "contentSprint": {
      "sprintId": "ag-digitalz-first-content-sprint-v1",
      "calendarDays": 7,
      "draftPostPackages": 21,
      "weeklyReportDrafts": 1,
      "pendingDraftApprovals": 22,
      "platforms": [
        "Instagram",
        "TikTok",
        "YouTube Shorts",
        "LinkedIn"
      ],
      "mode": "draft_only",
      "livePostingBlocked": true,
      "credentialsStored": false,
      "socialOauthConnected": false
    },
    "targetRepoChecks": [
      "npm.cmd run check passed",
      "npm.cmd test passed",
      "npm.cmd run build passed",
      "direct draft-only safety assertion passed",
      "git diff --check passed"
    ],
    "verifiedBy": "github_mcp_and_local_git",
    "verifiedAt": "2026-07-05T04:36:18Z"
  },
  "prohibitedActionsConfirmedFalse": [
    "create_repo",
    "create_more_than_one_branch",
    "open_more_than_one_pr",
    "merge_pr",
    "deploy_staging",
    "deploy_production",
    "connect_netlify",
    "connect_n8n",
    "activate_n8n",
    "change_domain",
    "change_dns",
    "use_paid_service",
    "use_credentials",
    "add_secrets",
    "connect_social_account",
    "post_content",
    "schedule_content",
    "send_dm",
    "send_comment",
    "use_analytics_api",
    "access_production_data",
    "access_customer_data",
    "use_private_client_data",
    "change_lead_gen",
    "change_ai_receptionist",
    "change_constitution",
    "create_accepted_lesson",
    "create_permanent_memory"
  ],
  "notes": "Executed exactly the owner-approved GitHub builder milestone: created branch ag-os/ag-digitalz-first-content-sprint-v1 in gurnoorbassi/ag-social-media-management-system, updated the eight approved starter files, and opened one pull request to main. The target PR was not merged. The sprint remains draft/staging only with 21 pending draft post packages, one weekly report draft, not_provided handles, not_connected accounts, draft_only posting mode, approval required, live posting blocked, credentials stored false, and social OAuth disconnected.",
  "createdAt": "2026-07-05T04:36:18Z",
  "updatedAt": "2026-07-05T04:36:18Z"
}
