{
  "connectorExecutionId": "connector-exec-20260704-social-media-netlify-staging-v1-1-live-result",
  "status": "done",
  "connectorId": "connector-netlify-mcp",
  "requestedAction": "redeploy_netlify_staging_site_from_main",
  "riskLevel": "R4",
  "projectId": "project-social-media-management-system-v1",
  "approvalRequired": true,
  "approvalId": "approval-20260704-social-media-netlify-staging-v1-1",
  "requiredPermissions": [
    "owner_approval",
    "active_approval_lock",
    "approval_not_expired",
    "target_repo_main_sha_verified",
    "boot_check_passed",
    "foundation_validation_passed",
    "runtime_tests_passed",
    "staging_only_scope"
  ],
  "evidenceRequired": [
    "approval_lock_approved",
    "approval_lock_not_expired",
    "target_repository_main_commit_7204846654ef448f6c0c78027a569b7707c618b8",
    "boot_check_ready",
    "foundation_validation_passed",
    "runtime_tests_passed",
    "netlify_deploy_ready",
    "staging_url_http_200"
  ],
  "safety": {
    "executesLiveAction": true,
    "usesCredentials": false,
    "triggersDeployment": false,
    "changesDomain": false,
    "usesPaidAction": false,
    "accessesProductionData": false
  },
  "result": {
    "repositoryFullName": "gurnoorbassi/ag-social-media-management-system",
    "repositoryUrl": "https://github.com/gurnoorbassi/ag-social-media-management-system",
    "targetBranch": "main",
    "sourceCommitSha": "7204846654ef448f6c0c78027a569b7707c618b8",
    "siteId": "f10b17ab-f751-48d5-9b4a-55d152ce7b38",
    "siteName": "ag-social-media-management-system-staging",
    "siteUrl": "https://ag-social-media-management-system-staging.netlify.app",
    "adminUrl": "https://app.netlify.com/projects/ag-social-media-management-system-staging",
    "deployId": "6a49ad36a73303e2fa05755f",
    "buildId": "6a49ad36a73303e2fa05755d",
    "deployStatus": "ready",
    "deployUrl": "https://6a49ad36a73303e2fa05755f--ag-social-media-management-system-staging.netlify.app",
    "branchDeployUrl": "https://main--ag-social-media-management-system-staging.netlify.app",
    "publishedAt": "2026-07-05T01:02:53.987Z",
    "verifiedAt": "2026-07-05T01:02:54Z",
    "verifiedBy": "netlify_mcp_and_http_head",
    "netlifyPlan": "nf_team_dev",
    "netlifyDeployContext": "production",
    "stagingInterpretation": "This is the primary deploy context of the dedicated Netlify staging-only site, not an AG Digitalz production domain, customer production domain, or production customer system.",
    "httpStatus": 200,
    "customDomainConfigured": false,
    "dnsChanged": false,
    "formsEnabled": false,
    "functionsDeployed": false,
    "edgeFunctionsDeployed": false,
    "paidFeatureUsed": false,
    "targetRepoEdited": false,
    "targetPullRequestMergedDuringDeploy": false,
    "socialAccountConnected": false,
    "socialCredentialsUsed": false,
    "postingTriggered": false,
    "schedulingTriggered": false,
    "analyticsApiUsed": false,
    "n8nActivated": false
  },
  "prohibitedActionsConfirmedFalse": [
    "deploy_production_customer_system",
    "change_domain",
    "change_dns",
    "add_custom_domain",
    "use_paid_service",
    "add_credentials_to_repo",
    "expose_secrets",
    "connect_social_accounts",
    "use_social_credentials",
    "post_content",
    "schedule_content",
    "use_analytics_api",
    "activate_n8n",
    "change_lead_gen",
    "change_ai_receptionist",
    "change_constitution",
    "edit_target_repo_files",
    "merge_target_repo_pr",
    "create_extra_repo",
    "connect_forms",
    "connect_live_apis",
    "add_tracking_scripts",
    "access_real_client_data",
    "access_production_data",
    "access_customer_data"
  ],
  "notes": "The action stayed inside the approved Netlify staging scope. The existing dedicated staging-only site was redeployed from a local checkout of verified target repo main commit 7204846654ef448f6c0c78027a569b7707c618b8. Netlify metadata labels the deploy context as production because the staging site has a primary deploy context, but no production AG Digitalz domain, customer domain, DNS, custom domain, customer production system, paid feature, credential storage, social account connection, posting, scheduling, analytics API, form, API, tracking, n8n activation, real client data, Lead Gen, AI Receptionist, Constitution, target repo edit, target PR merge during deploy, or extra repository action occurred.",
  "createdAt": "2026-07-05T01:02:54Z",
  "updatedAt": "2026-07-05T01:02:54Z"
}
