{
  "connectorExecutionId": "connector-exec-20260704-ag-digitalz-netlify-staging-redeploy-live-result",
  "status": "done",
  "connectorId": "connector-netlify-mcp",
  "requestedAction": "redeploy_netlify_staging_site_from_main",
  "riskLevel": "R4",
  "projectId": "project-social-media-management-system-v1",
  "approvalRequired": true,
  "approvalId": "approval-20260704-ag-digitalz-netlify-staging-redeploy",
  "requiredPermissions": [
    "owner_approval",
    "active_approval_lock",
    "approval_not_expired",
    "target_repo_main_sha_verified",
    "boot_check_passed",
    "foundation_validation_passed",
    "runtime_tests_passed",
    "staging_only_scope"
  ],
  "evidenceRequired": [
    "approval_lock_approved",
    "approval_lock_not_expired",
    "target_repository_main_commit_6f54d3b5b257c2662319f39c0b89f810e22289e5",
    "target_static_check_passed",
    "boot_check_ready",
    "foundation_validation_passed",
    "runtime_tests_passed",
    "netlify_deploy_ready",
    "staging_url_http_200"
  ],
  "safety": {
    "executesLiveAction": true,
    "usesCredentials": false,
    "triggersDeployment": false,
    "changesDomain": false,
    "usesPaidAction": false,
    "accessesProductionData": false
  },
  "result": {
    "repositoryFullName": "gurnoorbassi/ag-social-media-management-system",
    "repositoryUrl": "https://github.com/gurnoorbassi/ag-social-media-management-system",
    "targetBranch": "main",
    "sourceCommitSha": "6f54d3b5b257c2662319f39c0b89f810e22289e5",
    "siteId": "f10b17ab-f751-48d5-9b4a-55d152ce7b38",
    "siteName": "ag-social-media-management-system-staging",
    "siteUrl": "https://ag-social-media-management-system-staging.netlify.app",
    "adminUrl": "https://app.netlify.com/projects/ag-social-media-management-system-staging",
    "deployId": "6a49bd1932f7ae16701ece3f",
    "buildId": "6a49bd1932f7ae16701ece3d",
    "deployStatus": "ready",
    "deployUrl": "https://main--ag-social-media-management-system-staging.netlify.app",
    "permalink": "https://6a49bd1932f7ae16701ece3f--ag-social-media-management-system-staging.netlify.app",
    "publishedAt": "2026-07-05T02:10:39.382Z",
    "verifiedAt": "2026-07-05T02:10:39Z",
    "verifiedBy": "netlify_mcp_and_http_head",
    "netlifyPlan": "nf_team_dev",
    "netlifyDeployContext": "production",
    "stagingInterpretation": "This is the primary deploy context of the dedicated Netlify staging-only site, not an AG Digitalz production domain, customer production domain, or production customer system.",
    "httpStatus": 200,
    "branchHttpStatus": 200,
    "customDomainConfigured": false,
    "dnsChanged": false,
    "formsEnabled": false,
    "functionsDeployed": false,
    "edgeFunctionsDeployed": false,
    "paidFeatureUsed": false,
    "targetRepoEdited": false,
    "targetPullRequestMergedDuringDeploy": false,
    "socialAccountConnected": false,
    "socialCredentialsUsed": false,
    "postingTriggered": false,
    "schedulingTriggered": false,
    "analyticsApiUsed": false,
    "n8nActivated": false
  },
  "prohibitedActionsConfirmedFalse": [
    "deploy_production_customer_system",
    "change_domain",
    "change_dns",
    "add_custom_domain",
    "use_paid_service",
    "add_credentials_to_repo",
    "store_sensitive_values",
    "connect_social_accounts",
    "use_social_credentials",
    "post_content",
    "schedule_content",
    "use_analytics_api",
    "activate_n8n",
    "change_lead_gen",
    "change_ai_receptionist",
    "change_constitution",
    "edit_target_repo_files",
    "merge_target_repo_pr_during_deploy",
    "create_extra_repo",
    "connect_forms",
    "connect_live_apis",
    "add_tracking_scripts",
    "access_private_client_data",
    "access_production_data",
    "access_customer_data"
  ],
  "notes": "The action stayed inside the approved Netlify staging scope. The existing dedicated staging-only site was redeployed from a local checkout of verified target repo main commit 6f54d3b5b257c2662319f39c0b89f810e22289e5. Netlify metadata labels the deploy context as production because the staging site has a primary deploy context, but no production AG Digitalz domain, customer domain, DNS, custom domain, customer production system, paid feature, sensitive value storage, social account connection, posting, scheduling, analytics API, form, API, tracking, n8n activation, private client data, Lead Gen, AI Receptionist, Constitution, target repo edit, target PR merge during deploy, or extra repository action occurred.",
  "createdAt": "2026-07-05T02:10:39Z",
  "updatedAt": "2026-07-05T02:10:39Z"
}
