{
  "connectorExecutionId": "connector-exec-20260704-social-media-netlify-staging-live-result",
  "status": "done",
  "connectorId": "connector-netlify-mcp",
  "requestedAction": "create_netlify_staging_site_and_deploy_from_main",
  "riskLevel": "R4",
  "projectId": "project-social-media-management-system-v1",
  "approvalRequired": true,
  "approvalId": "approval-20260704-social-media-netlify-staging",
  "requiredPermissions": [
    "owner_approval",
    "active_approval_lock",
    "approval_not_expired",
    "ag_os_pr_85_merged",
    "ag_os_pr_86_merged",
    "ag_os_main_matches_origin_main",
    "target_repo_main_sha_verified",
    "boot_check_passed",
    "foundation_validation_passed",
    "runtime_tests_passed",
    "staging_only_scope"
  ],
  "evidenceRequired": [
    "approval_lock_approved",
    "approval_lock_not_expired",
    "ag_os_pr_85_merged",
    "ag_os_pr_86_merged",
    "ag_os_main_matches_origin_main",
    "target_repository_main_commit_d3fcd8c6435433169686c2ec404a5f00c6cc62bd",
    "target_static_check_passed",
    "boot_check_ready",
    "foundation_validation_passed",
    "runtime_tests_passed",
    "netlify_site_created",
    "netlify_deploy_ready",
    "staging_url_http_200"
  ],
  "safety": {
    "executesLiveAction": true,
    "usesCredentials": false,
    "triggersDeployment": false,
    "changesDomain": false,
    "usesPaidAction": false,
    "accessesProductionData": false
  },
  "result": {
    "repositoryFullName": "gurnoorbassi/ag-social-media-management-system",
    "repositoryUrl": "https://github.com/gurnoorbassi/ag-social-media-management-system",
    "targetBranch": "main",
    "sourceCommitSha": "d3fcd8c6435433169686c2ec404a5f00c6cc62bd",
    "sourceFiles": [
      "README.md",
      "package.json",
      "index.html",
      "src/main.js",
      "src/styles.css",
      "src/data/templates.js",
      "src/lib/safety.js",
      "src/lib/status.js"
    ],
    "siteId": "f10b17ab-f751-48d5-9b4a-55d152ce7b38",
    "siteName": "ag-social-media-management-system-staging",
    "siteUrl": "https://ag-social-media-management-system-staging.netlify.app",
    "adminUrl": "https://app.netlify.com/projects/ag-social-media-management-system-staging",
    "deployId": "6a49952960455c99f92eadc0",
    "buildId": "6a49952960455c99f92eadbe",
    "deployStatus": "ready",
    "deployUrl": "https://6a49952960455c99f92eadc0--ag-social-media-management-system-staging.netlify.app",
    "publishedAt": "2026-07-04T23:20:18.072Z",
    "verifiedAt": "2026-07-04T23:20:51.558Z",
    "verifiedBy": "netlify_mcp",
    "netlifyPlan": "nf_team_dev",
    "netlifyDeployContext": "production",
    "stagingInterpretation": "This is the primary deploy context of the dedicated Netlify staging-only site, not an AG Digitalz production domain, customer production domain, or production customer system.",
    "httpStatus": 200,
    "customDomainConfigured": false,
    "dnsChanged": false,
    "formsEnabled": false,
    "functionsDeployed": false,
    "edgeFunctionsDeployed": false,
    "paidFeatureUsed": false,
    "targetRepoEdited": false,
    "targetPullRequestMerged": false,
    "socialAccountConnected": false,
    "socialCredentialsUsed": false,
    "postingTriggered": false,
    "schedulingTriggered": false,
    "analyticsApiUsed": false,
    "n8nActivated": false
  },
  "prohibitedActionsConfirmedFalse": [
    "deploy_production_customer_system",
    "change_domain",
    "change_dns",
    "add_custom_domain",
    "use_paid_service",
    "add_credentials_to_repo",
    "expose_secrets",
    "connect_social_accounts",
    "use_social_credentials",
    "post_content",
    "schedule_content",
    "use_analytics_api",
    "activate_n8n",
    "change_lead_gen",
    "change_ai_receptionist",
    "change_constitution",
    "edit_target_repo_files",
    "merge_target_repo_pr",
    "create_extra_repo",
    "connect_forms",
    "connect_live_apis",
    "add_tracking_scripts",
    "access_real_client_data",
    "access_production_data",
    "access_customer_data"
  ],
  "notes": "The action stayed inside the approved Netlify staging scope. A dedicated staging-only site was created and populated from the verified target repo main commit. Netlify metadata labels the deploy context as production because the staging site has a primary deploy context, but no production AG Digitalz domain, customer domain, DNS, custom domain, customer production system, paid feature, credential storage, social account connection, posting, scheduling, analytics API, form, API, tracking, n8n activation, real client data, Lead Gen, AI Receptionist, Constitution, target repo edit, target PR merge, or extra repository action occurred.",
  "createdAt": "2026-07-04T23:20:51.558Z",
  "updatedAt": "2026-07-04T23:20:51.558Z"
}
