{
  "connectorExecutionId": "connector-exec-20260704-target-pr-merge-social-media-system-v1-live-result",
  "status": "done",
  "connectorId": "connector-github-mcp",
  "requestedAction": "merge_pr",
  "riskLevel": "R4",
  "projectId": "project-social-media-management-system-v1",
  "approvalRequired": true,
  "approvalId": "approval-20260704-target-pr-merge-social-media-system-v1",
  "requiredPermissions": [
    "owner_approval",
    "active_approval_lock",
    "ag_os_review_records_merged",
    "target_pr_open_and_mergeable",
    "target_pr_head_unchanged",
    "target_pr_file_manifest_unchanged",
    "boot_check_passed",
    "foundation_validation_passed",
    "runtime_tests_passed"
  ],
  "evidenceRequired": [
    "approval_lock_approved",
    "approval_lock_not_expired",
    "ag_os_pr_82_merged",
    "ag_os_main_matches_origin_main",
    "review_records_exist_in_main",
    "target_pull_request_open_before_merge",
    "target_pull_request_mergeable_before_merge",
    "reviewed_head_sha_match",
    "reviewed_file_manifest_match",
    "boot_check_passed",
    "foundation_validation_passed",
    "runtime_tests_passed",
    "pull_request_merged"
  ],
  "safety": {
    "executesLiveAction": true,
    "usesCredentials": false,
    "triggersDeployment": false,
    "changesDomain": false,
    "usesPaidAction": false,
    "accessesProductionData": false
  },
  "result": {
    "repositoryFullName": "gurnoorbassi/ag-social-media-management-system",
    "repositoryUrl": "https://github.com/gurnoorbassi/ag-social-media-management-system",
    "pullRequestNumber": 1,
    "pullRequestUrl": "https://github.com/gurnoorbassi/ag-social-media-management-system/pull/1",
    "pullRequestStateBeforeMerge": "open",
    "pullRequestStateAfterMerge": "closed",
    "pullRequestMerged": true,
    "baseBranch": "main",
    "headBranch": "ag-os/social-media-system-v1-starter",
    "headSha": "bf57520a6b08bf5fab9986adc2c9f7ae54b1e5bf",
    "mergeCommitSha": "d3fcd8c6435433169686c2ec404a5f00c6cc62bd",
    "mergedAt": "2026-07-04T22:31:45Z",
    "filesChanged": [
      "README.md",
      "package.json",
      "index.html",
      "src/main.js",
      "src/styles.css",
      "src/data/templates.js",
      "src/lib/safety.js",
      "src/lib/status.js"
    ],
    "reviewRecordRef": ".codex/audit/audit-runtime-target-pr-review-social-media-system-v1-20260704.json",
    "verifiedBy": "github_mcp",
    "verifiedAt": "2026-07-04T22:31:45Z"
  },
  "prohibitedActionsConfirmedFalse": [
    "create_repo",
    "create_branch",
    "create_files",
    "update_files",
    "open_pr",
    "open_more_than_one_pr",
    "deploy_staging",
    "deploy_production",
    "connect_netlify",
    "activate_n8n",
    "connect_social_accounts",
    "use_social_credentials",
    "post_content",
    "schedule_content",
    "use_dm_or_comments",
    "use_analytics_api",
    "change_domain",
    "change_dns",
    "use_paid_service",
    "use_credentials",
    "add_secrets",
    "access_real_client_private_data",
    "access_production_data",
    "access_customer_data",
    "change_lead_gen",
    "change_ai_receptionist",
    "change_constitution"
  ],
  "notes": "Executed only the owner-approved merge of target repo PR #1. No target repository files were edited during this action, and the target PR was already reviewed through AG OS source-of-truth records before merge. No deployment, Netlify connection, n8n activation, social account connection, credential use, posting, scheduling, DM/comment action, analytics API use, paid action, real client private data, production data, customer data, Lead Gen change, AI Receptionist change, Constitution change, additional repository, additional branch, or additional pull request occurred.",
  "createdAt": "2026-07-04T22:31:45.718Z",
  "updatedAt": "2026-07-04T22:31:45.718Z"
}
