{
  "connectorExecutionId": "connector-exec-20260704-social-media-starter-build-live-result",
  "status": "done",
  "connectorId": "connector-github-mcp",
  "requestedAction": "create_branch_create_files_update_files_open_pr",
  "riskLevel": "R4",
  "projectId": "project-social-media-management-system-v1",
  "approvalRequired": true,
  "approvalId": "approval-20260704-social-media-starter-build",
  "requiredPermissions": [
    "owner_approval",
    "active_approval_lock",
    "target_repo_exists",
    "target_main_branch_exists",
    "boot_check_passed",
    "foundation_validation_passed",
    "runtime_tests_passed"
  ],
  "evidenceRequired": [
    "owner_approval_confirmed",
    "target_repository_scope_exact_match",
    "target_branch_scope_exact_match",
    "approved_file_manifest_exact_match",
    "target_repo_private",
    "target_repo_no_secret_marker_hits",
    "target_repo_no_client_data_marker_hits",
    "target_repo_no_deploy_config_marker_hits",
    "boot_check_passed",
    "foundation_validation_passed",
    "runtime_tests_passed",
    "pull_request_opened"
  ],
  "safety": {
    "executesLiveAction": true,
    "usesCredentials": false,
    "triggersDeployment": false,
    "changesDomain": false,
    "usesPaidAction": false,
    "accessesProductionData": false
  },
  "result": {
    "repositoryFullName": "gurnoorbassi/ag-social-media-management-system",
    "repositoryUrl": "https://github.com/gurnoorbassi/ag-social-media-management-system",
    "repositoryVisibility": "private",
    "baseBranch": "main",
    "baseSha": "cc124110ab5e07e154317fc8eaeb90798e377993",
    "targetBranch": "ag-os/social-media-system-v1-starter",
    "pullRequestNumber": 1,
    "pullRequestState": "open",
    "pullRequestUrl": "https://github.com/gurnoorbassi/ag-social-media-management-system/pull/1",
    "pullRequestMerged": false,
    "headSha": "bf57520a6b08bf5fab9986adc2c9f7ae54b1e5bf",
    "filesChanged": [
      "README.md",
      "package.json",
      "index.html",
      "src/main.js",
      "src/styles.css",
      "src/data/templates.js",
      "src/lib/safety.js",
      "src/lib/status.js"
    ],
    "createdFiles": [
      "package.json",
      "index.html",
      "src/main.js",
      "src/styles.css",
      "src/data/templates.js",
      "src/lib/safety.js",
      "src/lib/status.js"
    ],
    "updatedFiles": [
      "README.md"
    ],
    "targetRepoCheck": "npm.cmd test passed",
    "verifiedBy": "github_mcp",
    "verifiedAt": "2026-07-04T21:35:09Z"
  },
  "prohibitedActionsConfirmedFalse": [
    "create_repo",
    "create_more_than_one_branch",
    "open_more_than_one_pr",
    "merge_pr",
    "deploy_staging",
    "deploy_production",
    "connect_netlify",
    "connect_n8n",
    "activate_n8n",
    "change_domain",
    "change_dns",
    "use_paid_service",
    "use_credentials",
    "add_secrets",
    "connect_social_account",
    "post_content",
    "schedule_content",
    "send_dm",
    "send_comment",
    "use_analytics_api",
    "access_production_data",
    "access_customer_data",
    "use_real_client_private_data",
    "change_lead_gen",
    "change_ai_receptionist",
    "change_constitution"
  ],
  "notes": "Executed exactly the owner-approved GitHub builder milestone: created branch ag-os/social-media-system-v1-starter in gurnoorbassi/ag-social-media-management-system, added or updated the eight approved starter files, and opened one pull request to main. The target PR was not merged. The starter app uses REQUIRED_ placeholders only, defaults account status to not_connected, defaults mode to draft_only, requires approval, and blocks live posting. No repository creation, deployment, Netlify, n8n activation, domain or DNS change, paid action, credential, social account connection, posting, scheduling, DM, comment, analytics API usage, production data, customer data, real client private data, Lead Gen change, AI Receptionist change, Constitution change, additional repository, additional branch, or additional pull request occurred.",
  "createdAt": "2026-07-04T21:35:09Z",
  "updatedAt": "2026-07-04T21:35:09Z"
}
