{
  "connectorExecutionId": "connector-exec-20260704-n8n-draft-workflow-live-result",
  "status": "done",
  "connectorId": "connector-n8n-mcp",
  "requestedAction": "create_inactive_n8n_draft_workflow_export_and_validate_json",
  "riskLevel": "R4",
  "projectId": "project-unregistered-construction-website",
  "approvalRequired": true,
  "approvalId": "approval-20260704-n8n-draft-workflow-proof",
  "requiredPermissions": [
    "owner_approval",
    "active_approval_lock",
    "approval_not_expired",
    "ag_os_pr_75_merged",
    "ag_os_pr_76_merged",
    "ag_os_main_matches_origin_main",
    "boot_check_passed",
    "foundation_validation_passed",
    "runtime_tests_passed",
    "n8n_mcp_oauth_authorization"
  ],
  "evidenceRequired": [
    "approval_lock_approved",
    "approval_lock_not_expired",
    "ag_os_pr_75_merged",
    "ag_os_pr_76_merged",
    "ag_os_main_matches_origin_main",
    "boot_check_ready",
    "foundation_validation_passed",
    "runtime_tests_passed",
    "n8n_workflow_sdk_reference_available",
    "n8n_workflow_code_validated",
    "n8n_workflow_created_inactive",
    "n8n_workflow_exported",
    "n8n_workflow_export_validated"
  ],
  "safety": {
    "executesLiveAction": true,
    "usesCredentials": false,
    "triggersDeployment": false,
    "changesDomain": false,
    "usesPaidAction": false,
    "accessesProductionData": false
  },
  "result": {
    "workflowName": "Construction Website Lead Intake Follow-up Draft",
    "workflowId": "WaD4uysb8ic0rfsH",
    "workflowUrl": "https://n8n.agdigitalz.net/workflow/WaD4uysb8ic0rfsH",
    "workflowCreated": true,
    "workflowActive": false,
    "workflowArchived": false,
    "activeVersionId": null,
    "triggerCount": 0,
    "nodeCount": 6,
    "nodeTypes": [
      "n8n-nodes-base.webhook",
      "n8n-nodes-base.code"
    ],
    "autoAssignedCredentials": [],
    "credentialConnected": false,
    "outboundMessagesConfigured": false,
    "realExternalApisConfigured": false,
    "productionWorkflowTouched": false,
    "leadGenWorkflowTouched": false,
    "aiReceptionistWorkflowTouched": false,
    "workflowExported": true,
    "workflowExportPath": ".codex/n8n/exports/n8n-export-20260704-construction-lead-draft-proof-success.json",
    "workflowSdkValidationPassed": true,
    "workflowExportValidationPassed": true,
    "preExecutionValidationPassed": true,
    "preExecutionBootCheckReady": true,
    "preExecutionTestsPassed": true
  },
  "prohibitedActionsConfirmedFalse": [
    "activate_workflow",
    "connect_credentials",
    "send_email",
    "send_sms",
    "send_whatsapp",
    "send_outbound_message",
    "call_real_external_api",
    "execute_workflow_with_real_data",
    "touch_production_n8n_workflow",
    "touch_lead_gen_workflow",
    "touch_ai_receptionist_workflow",
    "deploy",
    "change_domain",
    "change_dns",
    "use_paid_service",
    "access_production_data",
    "access_customer_data",
    "change_constitution",
    "create_live_automation"
  ],
  "notes": "The n8n MCP connector was authorized in the Codex session. AG OS created one inactive draft workflow for the approved proof, verified active false and no auto-assigned credentials, exported the workflow JSON into AG OS source tree, and stopped before workflow activation, real data execution, outbound messaging, external APIs, production n8n workflows, Lead Gen workflows, AI Receptionist workflows, deployments, domain/DNS, paid tools, customer data, production data, or Constitution changes.",
  "createdAt": "2026-07-04T11:56:19.923Z",
  "updatedAt": "2026-07-04T11:56:19.923Z"
}
